NVME Identify Controller:
vid       : 0x1217
ssvid     : 0x2
sn        : 29036200000000000001
mn        : BAYHUB HynixhC8aP>303064GB Disk
fr        : 10100065
rab       : 5
ieee      : 00d051
cmic      : 0
mdts      : 6
cntlid    : 1
ver       : 10300
rtd3r     : 7a120
rtd3e     : 1e8480
oaes      : 0x20
ctratt    : 0
rrls      : 0
oacs      : 0x4
acl       : 4
aerl      : 4
frmw      : 0xa
lpa       : 0
elpe      : 0
npss      : 1
avscc     : 0
apsta     : 0
wctemp    : 343
cctemp    : 353
mtfa      : 0
hmpre     : 0
hmmin     : 0
tnvmcap   : 0
unvmcap   : 0
rpmbs     : 0
edstt     : 0
dsto      : 0
fwug      : 0
kas       : 0
hctma     : 0
mntmt     : 0
mxtmt     : 0
sanicap   : 0
hmminds   : 0
hmmaxd    : 0
nsetidmax : 0
sqes      : 0x66
cqes      : 0x44
maxcmd    : 0
nn        : 1
oncs      : 0x4
fuses     : 0
fna       : 0
vwc       : 0x1
awun      : 0
awupf     : 0
nvscc     : 0
acwu      : 0
sgls      : 0
subnqn    :
ioccsz    : 0
iorcsz    : 0
icdoff    : 0
ctrattr   : 0
msdbd     : 0
ps    0 : mp:5.00W operational enlat:0 exlat:0 rrt:0 rrl:0
          rwt:0 rwl:0 idle_power:- active_power:-
ps    1 : mp:0.0025W non-operational enlat:4000 exlat:10000 rrt:1 rrl:1
          rwt:1 rwl:1 idle_power:- active_power:-
