NVME Identify Controller:
vid     : 0x8086
ssvid   : 0x8086
sn      : BTPY634205V1256D    
mn      : INTEL SSDPEKKW256G7                     
fr      :  PSF100C
rab     : 6
ieee    : 5cd2e4
cmic    : 0
mdts    : 5
cntlid  : 1
ver     : 10200
rtd3r   : 249f0
rtd3e   : 13880
oaes    : 0
oacs    : 0x6
acl     : 4
aerl    : 7
frmw    : 0x2
lpa     : 0x3
elpe    : 63
npss    : 4
avscc   : 0
apsta   : 0x1
wctemp  : 343
cctemp  : 353
mtfa    : 20
hmpre   : 0
hmmin   : 0
tnvmcap : 0
unvmcap : 0
rpmbs   : 0
sqes    : 0x66
cqes    : 0x44
nn      : 1
oncs    : 0x1e
fuses   : 0
fna     : 0x4
vwc     : 0x1
awun    : 0
awupf   : 0
nvscc   : 0
acwu    : 0
sgls    : 0
subnqn  : 
ps    0 : mp:9.00W operational enlat:5 exlat:5 rrt:0 rrl:0
          rwt:0 rwl:0 idle_power:- active_power:-
ps    1 : mp:4.60W operational enlat:30 exlat:30 rrt:1 rrl:1
          rwt:1 rwl:1 idle_power:- active_power:-
ps    2 : mp:3.80W operational enlat:30 exlat:30 rrt:2 rrl:2
          rwt:2 rwl:2 idle_power:- active_power:-
ps    3 : mp:0.0700W non-operational enlat:10000 exlat:300 rrt:3 rrl:3
          rwt:3 rwl:3 idle_power:- active_power:-
ps    4 : mp:0.0050W non-operational enlat:2000 exlat:10000 rrt:4 rrl:4
          rwt:4 rwl:4 idle_power:- active_power:-
