
/dev/sda:

ATA device, with non-removable media
	Model Number:       PS3109S9                                
	Serial Number:      
	Firmware Revision:  S9RBOOT2
Standards:
	Used: ATA/ATAPI-7 T13 1532D revision 4a 
	Supported: 7 6 5 4 
Configuration:
	Logical         max     current
	cylinders       160     160
	heads           8       8
	sectors/track   32      32
	--
	CHS current addressable sectors:      40960
	LBA    user addressable sectors:      40961
	Logical/Physical Sector size:           512 bytes
	device size with M = 1024*1024:          20 MBytes
	device size with M = 1000*1000:          20 MBytes 
	cache/buffer size  = 1 KBytes (type=DualPort)
Capabilities:
	LBA, IORDY(may be)(cannot be disabled)
	Standby timer values: spec'd by Vendor, no device specific minimum
	R/W multiple sector transfer: Max = 1   Current = 0
	DMA: not supported
	PIO: pio0 pio1 pio2 
Commands/features:
	Enabled Supported:
	   *    Power Management feature set
	   *    WRITE_BUFFER command
	   *    READ_BUFFER command
	   *    NOP cmd
	   *    DOWNLOAD_MICROCODE
	   *    Mandatory FLUSH_CACHE
	   *    FLUSH_CACHE_EXT
	   *    Gen1 signaling speed (1.5Gb/s)
	   *    Gen2 signaling speed (3.0Gb/s)
	   *    Gen3 signaling speed (6.0Gb/s)
Checksum: correct
