NVME Identify Controller:
vid     : 0x144d
ssvid   : 0x144d
sn      : S3VBNY0J708187      
mn      : SAMSUNG KUS040205M-B001                 
fr      : DXC81G1T
rab     : 2
ieee    : 002538
cmic    : 0
mdts    : 7
cntlid  : 3
ver     : 10200
rtd3r   : 186a0
rtd3e   : 989680
oaes    : 0
oacs    : 0x6
acl     : 7
aerl    : 3
frmw    : 0x16
lpa     : 0x3
elpe    : 63
npss    : 4
avscc   : 0x1
apsta   : 0x1
wctemp  : 364
cctemp  : 366
mtfa    : 0
hmpre   : 0
hmmin   : 0
tnvmcap : 512110190592
unvmcap : 0
rpmbs   : 0
sqes    : 0x66
cqes    : 0x44
nn      : 1
oncs    : 0x1f
fuses   : 0
fna     : 0
vwc     : 0x1
awun    : 255
awupf   : 0
nvscc   : 1
acwu    : 0
sgls    : 0
subnqn  : 
ps    0 : mp:3.00W operational enlat:0 exlat:0 rrt:0 rrl:0
          rwt:0 rwl:0 idle_power:- active_power:-
ps    1 : mp:2.40W operational enlat:5 exlat:5 rrt:1 rrl:1
          rwt:1 rwl:1 idle_power:- active_power:-
ps    2 : mp:1.90W operational enlat:10 exlat:10 rrt:2 rrl:2
          rwt:2 rwl:2 idle_power:- active_power:-
ps    3 : mp:0.0600W non-operational enlat:300 exlat:800 rrt:3 rrl:3
          rwt:3 rwl:3 idle_power:- active_power:-
ps    4 : mp:0.0050W non-operational enlat:1800 exlat:3700 rrt:4 rrl:4
          rwt:4 rwl:4 idle_power:- active_power:-
